{"$schema":"https://json-schema.org/draft/2020-12/schema","$id":"https://schemas.xtcsystems.example/ksef-scenariocheck/observation-v1.schema.json","title":"KSeF ScenarioCheck observation v1","type":"object","additionalProperties":false,"required":["schemaVersion","profileId","scenarioFamily","scenarioId","observationId","events"],"properties":{"schemaVersion":{"const":"1.0"},"profileId":{"type":"string","maxLength":128},"scenarioFamily":{"const":"offline24-timeline"},"scenarioId":{"$ref":"#/$defs/id"},"observationId":{"$ref":"#/$defs/id"},"generatedAt":{"$ref":"#/$defs/utc"},"sourceSystem":{"type":"object","additionalProperties":false,"required":["kind"],"properties":{"kind":{"enum":["integration-test-harness","fixture-generator","ci-pipeline"]},"version":{"type":"string","pattern":"^[A-Za-z0-9._+-]{1,32}$"}}},"events":{"type":"array","minItems":1,"maxItems":256,"items":{"$ref":"#/$defs/event"}}},"$defs":{"id":{"type":"string","pattern":"^[a-z][a-z0-9]*(?:[._-][a-z0-9]+)*$","maxLength":64},"ref":{"type":"string","pattern":"^syn:[A-Za-z0-9][A-Za-z0-9._-]{0,47}$"},"utc":{"type":"string","format":"date-time","pattern":"Z$","maxLength":40},"event":{"oneOf":[{"type":"object","additionalProperties":false,"required":["id","kind","occurredAt","sequence","reference","issueDate"],"properties":{"id":{"$ref":"#/$defs/id"},"kind":{"const":"invoice-issued"},"occurredAt":{"$ref":"#/$defs/utc"},"sequence":{"type":"integer","minimum":0,"maximum":65535},"reference":{"$ref":"#/$defs/ref"},"issueDate":{"type":"string","pattern":"^[0-9]{4}-[0-9]{2}-[0-9]{2}$"}}},{"type":"object","additionalProperties":false,"required":["id","kind","occurredAt","sequence","reference","offlineMode"],"properties":{"id":{"$ref":"#/$defs/id"},"kind":{"const":"offline-mode-declared"},"occurredAt":{"$ref":"#/$defs/utc"},"sequence":{"type":"integer","minimum":0,"maximum":65535},"reference":{"$ref":"#/$defs/ref"},"offlineMode":{"type":"boolean"}}},{"type":"object","additionalProperties":false,"required":["id","kind","occurredAt","sequence","reference","attempt"],"properties":{"id":{"$ref":"#/$defs/id"},"kind":{"const":"transmission-attempt"},"occurredAt":{"$ref":"#/$defs/utc"},"sequence":{"type":"integer","minimum":0,"maximum":65535},"reference":{"$ref":"#/$defs/ref"},"attempt":{"type":"integer","minimum":1,"maximum":100}}}]}}}
